Information for device CH55x DevBoard (VID=0xFFFF PID=0xCDC1):

------------------------------
Connection Information:
------------------------------
Device current bus speed: FullSpeed
Device supports USB 1.1 specification
Device supports USB 2.0 specification
Device address: 0x002F
Current configuration value: 0x01
Number of open pipes: 3


------------------------------
Device Descriptor:
------------------------------
0x12	bLength
0x01	bDescriptorType
0x0110	bcdUSB
0x00	bDeviceClass      
0x00	bDeviceSubClass   
0x00	bDeviceProtocol   
0x08	bMaxPacketSize0   (8 bytes)
0xFFFF	idVendor
0xCDC1	idProduct
0x0100	bcdDevice
0x01	iManufacturer   "jimmyCraft"
0x02	iProduct        "CH55x DevBoard"
0x03	iSerialNumber   "CH55xCDC"
0x01	bNumConfigurations


-------------------------
Configuration Descriptor:
-------------------------
0x09	bLength
0x02	bDescriptorType
0x004B	wTotalLength   (75 bytes)
0x02	bNumInterfaces
0x01	bConfigurationValue
0x00	iConfiguration
0x80	bmAttributes   (Bus-powered Device)
0x19	bMaxPower      (50 mA)

Interface Association Descriptor:
------------------------------
0x08	bLength
0x0B	bDescriptorType
0x00	bFirstInterface
0x02	bInterfaceCount
0x02	bFunctionClass      (Communication Device Class)
0x02	bFunctionSubClass   (Abstract Control Model - ACM)
0x01	bFunctionProtocol   (ITU-T V.250)
0x04	iFunction   "CDC-Serial"

Interface Descriptor:
------------------------------
0x09	bLength
0x04	bDescriptorType
0x00	bInterfaceNumber
0x00	bAlternateSetting
0x01	bNumEndPoints
0x02	bInterfaceClass      (Communication Device Class)
0x02	bInterfaceSubClass   (Abstract Control Model - ACM)
0x01	bInterfaceProtocol   (ITU-T V.250)
0x04	iInterface   "CDC-Serial"

CDC Header Functional Descriptor:
------------------------------
0x05	bFunctionalLength
0x24	bDescriptorType
0x00	bDescriptorSubtype
0x0110	bcdCDC

CDC Call Management Functional Descriptor:
------------------------------
0x05	bFunctionalLength
0x24	bDescriptorType
0x01	bDescriptorSubtype
0x00	bmCapabilities
0x00	bDataInterface

CDC Abstract Control Management Functional Descriptor:
------------------------------
0x04	bFunctionalLength
0x24	bDescriptorType
0x02	bDescriptorSubtype
0x02	bmCapabilities

CDC Union Functional Descriptor:
------------------------------
0x05	bFunctionalLength
0x24	bDescriptorType
0x06	bDescriptorSubtype
0x00	bControlInterface
0x01	bSubordinateInterface(0)

Endpoint Descriptor:
------------------------------
0x07	bLength
0x05	bDescriptorType
0x81	bEndpointAddress  (IN endpoint 1)
0x03	bmAttributes      (Transfer: Interrupt / Synch: None / Usage: Data)
0x0008	wMaxPacketSize    (1 x 8 bytes)
0x01	bInterval         (1 frames)

Interface Descriptor:
------------------------------
0x09	bLength
0x04	bDescriptorType
0x01	bInterfaceNumber
0x00	bAlternateSetting
0x02	bNumEndPoints
0x0A	bInterfaceClass      (CDC Data)
0x00	bInterfaceSubClass   
0x00	bInterfaceProtocol   
0x04	iInterface   "CDC-Serial"

Endpoint Descriptor:
------------------------------
0x07	bLength
0x05	bDescriptorType
0x02	bEndpointAddress  (OUT endpoint 2)
0x02	bmAttributes      (Transfer: Bulk / Synch: None / Usage: Data)
0x0040	wMaxPacketSize    (64 bytes)
0x00	bInterval         

Endpoint Descriptor:
------------------------------
0x07	bLength
0x05	bDescriptorType
0x82	bEndpointAddress  (IN endpoint 2)
0x02	bmAttributes      (Transfer: Bulk / Synch: None / Usage: Data)
0x0040	wMaxPacketSize    (64 bytes)
0x00	bInterval         

Microsoft OS Descriptor:
------------------------------
0x12	bLength
0x03	bDescriptorType
Hex dump: 
0x12 0x03 0x43 0x00 0x48 0x00 0x35 0x00 0x35 0x00 
0x78 0x00 0x43 0x00 0x44 0x00 0x43 0x00 


--------------------------------
String Descriptor Table
--------------------------------
Index  LANGID  String
0x00   0x0000  0x0409 
0x01   0x0409  "jimmyCraft"
0x02   0x0409  "CH55x DevBoard"
0x03   0x0409  "CH55xCDC"
0x04   0x0409  "CDC-Serial"

------------------------------

Connection path for device: 
USB xHCI ????????
Root Hub
CH55x DevBoard (VID=0xFFFF PID=0xCDC1) Port: 3

Running on: Windows 10 or greater (Build Version 18363)

Brought to you by TDD v2.19.0, Dec  5 2023, 12:08:38
