Information for device VEN-I2C-Bridge (VID=0x16C0 PID=0x05DC):

------------------------------
Connection Information:
------------------------------
Device current bus speed: FullSpeed
Device supports USB 1.1 specification
Device supports USB 2.0 specification
Device address: 0x0018
Current configuration value: 0x00
Number of open pipes: 0


------------------------------
Device Descriptor:
------------------------------
0x12	bLength
0x01	bDescriptorType
0x0200	bcdUSB
0x00	bDeviceClass      
0x00	bDeviceSubClass   
0x00	bDeviceProtocol   
0x40	bMaxPacketSize0   (64 bytes)
0x16C0	idVendor
0x05DC	idProduct
0x0100	bcdDevice
0x01	iManufacturer   "wagiminator"
0x02	iProduct        "VEN-I2C-Bridge"
0x03	iSerialNumber   "CH55x"
0x01	bNumConfigurations


-------------------------
Configuration Descriptor:
-------------------------
0x09	bLength
0x02	bDescriptorType
0x0020	wTotalLength   (32 bytes)
0x01	bNumInterfaces
0x01	bConfigurationValue
0x00	iConfiguration
0x80	bmAttributes   (Bus-powered Device)
0x32	bMaxPower      (100 mA)

Interface Descriptor:
------------------------------
0x09	bLength
0x04	bDescriptorType
0x00	bInterfaceNumber
0x00	bAlternateSetting
0x02	bNumEndPoints
0xFF	bInterfaceClass      (Vendor specific)
0x00	bInterfaceSubClass   
0x00	bInterfaceProtocol   
0x04	iInterface   "Vendor Bulk"

Endpoint Descriptor:
------------------------------
0x07	bLength
0x05	bDescriptorType
0x01	bEndpointAddress  (OUT endpoint 1)
0x02	bmAttributes      (Transfer: Bulk / Synch: None / Usage: Data)
0x0040	wMaxPacketSize    (64 bytes)
0x00	bInterval         

Endpoint Descriptor:
------------------------------
0x07	bLength
0x05	bDescriptorType
0x81	bEndpointAddress  (IN endpoint 1)
0x02	bmAttributes      (Transfer: Bulk / Synch: None / Usage: Data)
0x0040	wMaxPacketSize    (64 bytes)
0x00	bInterval         

Microsoft OS Descriptor:
------------------------------
0x12	bLength
0x03	bDescriptorType
Hex dump: 
0x12 0x03 0x4D 0x00 0x53 0x00 0x46 0x00 0x54 0x00 
0x31 0x00 0x30 0x00 0x30 0x00 0x5D 0x00 


--------------------------------
String Descriptor Table
--------------------------------
Index  LANGID  String
0x00   0x0000  0x0409 
0x01   0x0409  "wagiminator"
0x02   0x0409  "VEN-I2C-Bridge"
0x03   0x0409  "CH55x"
0x04   0x0409  "Vendor Bulk"

------------------------------

Connection path for device: 
USB xHCI ????????
Root Hub
VEN-I2C-Bridge (VID=0x16C0 PID=0x05DC) Port: 3

Running on: Windows 10 or greater (Build Version 18363)

Brought to you by TDD v2.19.0, Dec  5 2023, 12:08:38
