Information for device Hid-INT (VID=0x16C0 PID=0x05DF):

------------------------------
Connection Information:
------------------------------
Device current bus speed: FullSpeed
Device supports USB 1.1 specification
Device supports USB 2.0 specification
Device address: 0x001E
Current configuration value: 0x01
Number of open pipes: 2


------------------------------
Device Descriptor:
------------------------------
0x12	bLength
0x01	bDescriptorType
0x0110	bcdUSB
0x00	bDeviceClass      
0x00	bDeviceSubClass   
0x00	bDeviceProtocol   
0x08	bMaxPacketSize0   (8 bytes)
0x16C0	idVendor
0x05DF	idProduct
0x0100	bcdDevice
0x01	iManufacturer   "jimmyCraft."
0x02	iProduct        "Hid-INT"
0x03	iSerialNumber   "CH55xHID"
0x01	bNumConfigurations


-------------------------
Configuration Descriptor:
-------------------------
0x09	bLength
0x02	bDescriptorType
0x0029	wTotalLength   (41 bytes)
0x01	bNumInterfaces
0x01	bConfigurationValue
0x00	iConfiguration
0x80	bmAttributes   (Bus-powered Device)
0x32	bMaxPower      (100 mA)

Interface Descriptor:
------------------------------
0x09	bLength
0x04	bDescriptorType
0x00	bInterfaceNumber
0x00	bAlternateSetting
0x02	bNumEndPoints
0x03	bInterfaceClass      (Human Interface Device Class)
0x00	bInterfaceSubClass   
0x00	bInterfaceProtocol   
0x04	iInterface   "HID DataINT"

HID Descriptor:
------------------------------
0x09	bLength
0x21	bDescriptorType
0x0110	bcdHID
0x00	bCountryCode
0x01	bNumDescriptors
0x22	bDescriptorType   (Report descriptor)
0x0018	bDescriptorLength

Endpoint Descriptor:
------------------------------
0x07	bLength
0x05	bDescriptorType
0x81	bEndpointAddress  (IN endpoint 1)
0x03	bmAttributes      (Transfer: Interrupt / Synch: None / Usage: Data)
0x0040	wMaxPacketSize    (1 x 64 bytes)
0x01	bInterval         (1 frames)

Endpoint Descriptor:
------------------------------
0x07	bLength
0x05	bDescriptorType
0x01	bEndpointAddress  (OUT endpoint 1)
0x03	bmAttributes      (Transfer: Interrupt / Synch: None / Usage: Data)
0x0040	wMaxPacketSize    (1 x 64 bytes)
0x01	bInterval         (1 frames)

Microsoft OS Descriptor:
------------------------------
0x12	bLength
0x03	bDescriptorType
Hex dump: 
0x12 0x03 0x43 0x00 0x48 0x00 0x35 0x00 0x35 0x00 
0x78 0x00 0x48 0x00 0x49 0x00 0x44 0x00 


--------------------------------
String Descriptor Table
--------------------------------
Index  LANGID  String
0x00   0x0000  0x0409 
0x01   0x0409  "jimmyCraft."
0x02   0x0409  "Hid-INT"
0x03   0x0409  "CH55xHID"
0x04   0x0409  "HID DataINT"

------------------------------

Connection path for device: 
USB xHCI ????????
Root Hub
Hid-INT (VID=0x16C0 PID=0x05DF) Port: 3

Running on: Windows 10 or greater (Build Version 18363)

Brought to you by TDD v2.19.0, Dec  5 2023, 12:08:38
